{
  "schemaVersion": "1.0.0",
  "generatedAt": "2026-09-06T15:47:24.394Z",
  "latestCheck": {
    "startedAt": "2026-09-05T16:40:33.000Z",
    "completedAt": "2026-09-05T16:41:46.000Z",
    "state": "complete"
  },
  "lastRoutineCheck": {
    "startedAt": "2026-09-05T15:34:10.000Z",
    "completedAt": "2026-09-05T15:35:26.000Z",
    "state": "complete",
    "scheduledFor": "2026-09-05T12:43:00.000Z"
  }
}
